{"admission_timing_protocol":"sqlite_begin_immediate_then_harness_clock_v1","bindings":[{"capability":"event_revelation","checkpoint_key":"next-a-share-earnings-surprise","job_id":"prospective-collection-job-21294990fa851d0d64cc913e04bb5c21529685b54167660074906ab5a78b2ba6","route_kind":"issuer_event"},{"capability":"event_revelation","checkpoint_key":"next-a-share-earnings-surprise","job_id":"prospective-collection-job-37b6f6cc6c1149e9a3e200d83a64308fda2d0e4e3d9d82f83f2beae4e9cf0533","route_kind":"issuer_event"},{"capability":"exposure_candidates","checkpoint_key":"next-a-share-earnings-surprise","job_id":"prospective-collection-job-488181db9f794bf89ba253889e904bfa16e1c0f33e705990be024f76558d8045","route_kind":"industry_to_tradable_mapping"},{"capability":"exposure_candidates","checkpoint_key":"next-a-share-earnings-surprise","job_id":"prospective-collection-job-cf1fa7f0bed68a250bcf21d0a147642e2641b841227abdf900737b4c9a391601","route_kind":"industry_to_tradable_mapping"},{"capability":"exposure_candidates","checkpoint_key":"next-a-share-earnings-surprise","job_id":"prospective-collection-job-fbca7a5b69c9274cf021a69e5c6c72fda59d42b10e1d076b942eb7b97dd8a926","route_kind":"tradable_instrument_master"},{"capability":"market_context","checkpoint_key":"next-a-share-earnings-surprise","job_id":"prospective-collection-job-a8e71f1c12f68a6aaf56b8796475a4a863d68425d06e44fb7a800ab853e10193","route_kind":"market_index_price"},{"capability":"event_revelation","checkpoint_key":"next-a-share-policy-event","job_id":"prospective-collection-job-414d65ba67b007dfa7a2e1353b8a09fbf29820a2e87a6a5fd0a8d425dd450ead","route_kind":"established_news"},{"capability":"event_revelation","checkpoint_key":"next-a-share-policy-event","job_id":"prospective-collection-job-6854c9819c453b746dd9b1cba24eb313a9184a1c177b4fb475a6df386e3d86a7","route_kind":"established_news"},{"capability":"event_revelation","checkpoint_key":"next-a-share-policy-event","job_id":"prospective-collection-job-75950fb4962c40ed7d87e982d3c06916a9642cb3e3921613e22bc5c69afcec0e","route_kind":"established_news"},{"capability":"event_revelation","checkpoint_key":"next-a-share-policy-event","job_id":"prospective-collection-job-a8d98080997cfdd1bc6aaf60c2f93baeaf1a3b09c0bc32fb9c138ab46a4d8cde","route_kind":"established_news"},{"capability":"event_revelation","checkpoint_key":"next-a-share-policy-event","job_id":"prospective-collection-job-b2960c57b05bf98017a98f1a0b0507d18014346abb26769267f5d083a767f303","route_kind":"established_news"},{"capability":"event_revelation","checkpoint_key":"next-a-share-policy-event","job_id":"prospective-collection-job-c2c038492f381993183387aca74a5852cf52a731c917012e2b6bb467da222396","route_kind":"established_news"},{"capability":"event_revelation","checkpoint_key":"next-a-share-policy-event","job_id":"prospective-collection-job-df964d1dd6f599a3c63bae02cfeb0de986b0eca8721b50568023433c04c7eae9","route_kind":"established_news"},{"capability":"event_revelation","checkpoint_key":"next-a-share-policy-event","job_id":"prospective-collection-job-e275fa1f9a6d6cb4a7ab37bb1869db8f2f5229db7f8227144b944654cb00814c","route_kind":"established_news"},{"capability":"event_revelation","checkpoint_key":"next-a-share-policy-event","job_id":"prospective-collection-job-ff06ba788efbf292f725bed5e282b58cce3316375b58fd085c759b4d2a1eead6","route_kind":"official_event"},{"capability":"exposure_candidates","checkpoint_key":"next-a-share-policy-event","job_id":"prospective-collection-job-488181db9f794bf89ba253889e904bfa16e1c0f33e705990be024f76558d8045","route_kind":"industry_to_tradable_mapping"},{"capability":"exposure_candidates","checkpoint_key":"next-a-share-policy-event","job_id":"prospective-collection-job-cf1fa7f0bed68a250bcf21d0a147642e2641b841227abdf900737b4c9a391601","route_kind":"industry_to_tradable_mapping"},{"capability":"exposure_candidates","checkpoint_key":"next-a-share-policy-event","job_id":"prospective-collection-job-fbca7a5b69c9274cf021a69e5c6c72fda59d42b10e1d076b942eb7b97dd8a926","route_kind":"tradable_instrument_master"},{"capability":"market_context","checkpoint_key":"next-a-share-policy-event","job_id":"prospective-collection-job-a8e71f1c12f68a6aaf56b8796475a4a863d68425d06e44fb7a800ab853e10193","route_kind":"market_index_price"},{"capability":"event_revelation","checkpoint_key":"next-material-a-share-event","job_id":"prospective-collection-job-414d65ba67b007dfa7a2e1353b8a09fbf29820a2e87a6a5fd0a8d425dd450ead","route_kind":"established_news"},{"capability":"event_revelation","checkpoint_key":"next-material-a-share-event","job_id":"prospective-collection-job-6854c9819c453b746dd9b1cba24eb313a9184a1c177b4fb475a6df386e3d86a7","route_kind":"established_news"},{"capability":"event_revelation","checkpoint_key":"next-material-a-share-event","job_id":"prospective-collection-job-75950fb4962c40ed7d87e982d3c06916a9642cb3e3921613e22bc5c69afcec0e","route_kind":"established_news"},{"capability":"event_revelation","checkpoint_key":"next-material-a-share-event","job_id":"prospective-collection-job-a8d98080997cfdd1bc6aaf60c2f93baeaf1a3b09c0bc32fb9c138ab46a4d8cde","route_kind":"established_news"},{"capability":"event_revelation","checkpoint_key":"next-material-a-share-event","job_id":"prospective-collection-job-b2960c57b05bf98017a98f1a0b0507d18014346abb26769267f5d083a767f303","route_kind":"established_news"},{"capability":"event_revelation","checkpoint_key":"next-material-a-share-event","job_id":"prospective-collection-job-c2c038492f381993183387aca74a5852cf52a731c917012e2b6bb467da222396","route_kind":"established_news"},{"capability":"event_revelation","checkpoint_key":"next-material-a-share-event","job_id":"prospective-collection-job-df964d1dd6f599a3c63bae02cfeb0de986b0eca8721b50568023433c04c7eae9","route_kind":"established_news"},{"capability":"event_revelation","checkpoint_key":"next-material-a-share-event","job_id":"prospective-collection-job-e275fa1f9a6d6cb4a7ab37bb1869db8f2f5229db7f8227144b944654cb00814c","route_kind":"established_news"},{"capability":"exposure_candidates","checkpoint_key":"next-material-a-share-event","job_id":"prospective-collection-job-488181db9f794bf89ba253889e904bfa16e1c0f33e705990be024f76558d8045","route_kind":"industry_to_tradable_mapping"},{"capability":"exposure_candidates","checkpoint_key":"next-material-a-share-event","job_id":"prospective-collection-job-cf1fa7f0bed68a250bcf21d0a147642e2641b841227abdf900737b4c9a391601","route_kind":"industry_to_tradable_mapping"},{"capability":"exposure_candidates","checkpoint_key":"next-material-a-share-event","job_id":"prospective-collection-job-fbca7a5b69c9274cf021a69e5c6c72fda59d42b10e1d076b942eb7b97dd8a926","route_kind":"tradable_instrument_master"},{"capability":"market_context","checkpoint_key":"next-material-a-share-event","job_id":"prospective-collection-job-a8e71f1c12f68a6aaf56b8796475a4a863d68425d06e44fb7a800ab853e10193","route_kind":"market_index_price"},{"capability":"event_revelation","checkpoint_key":"next-nbs-cpi-ppi-release","job_id":"prospective-collection-job-6035118eec87bf767a7ac86c294f0a517c844182cd6350bdace941ca1e071b6d","route_kind":"official_macro_release"},{"capability":"exposure_candidates","checkpoint_key":"next-nbs-cpi-ppi-release","job_id":"prospective-collection-job-488181db9f794bf89ba253889e904bfa16e1c0f33e705990be024f76558d8045","route_kind":"industry_to_tradable_mapping"},{"capability":"exposure_candidates","checkpoint_key":"next-nbs-cpi-ppi-release","job_id":"prospective-collection-job-cf1fa7f0bed68a250bcf21d0a147642e2641b841227abdf900737b4c9a391601","route_kind":"industry_to_tradable_mapping"},{"capability":"exposure_candidates","checkpoint_key":"next-nbs-cpi-ppi-release","job_id":"prospective-collection-job-fbca7a5b69c9274cf021a69e5c6c72fda59d42b10e1d076b942eb7b97dd8a926","route_kind":"tradable_instrument_master"},{"capability":"market_context","checkpoint_key":"next-nbs-cpi-ppi-release","job_id":"prospective-collection-job-a8e71f1c12f68a6aaf56b8796475a4a863d68425d06e44fb7a800ab853e10193","route_kind":"market_index_price"}],"execution_capability":false,"historical_pit_claim":false,"model_calls_authorized":false,"plan_id":"prospective-checkpoint-route-plan-8a2008dc7648227e86dd58d7e5345067c85d22c530addf17734c00d8530ce283","registration_id":"prospective-diagnostic-registration-cbd6330be9ba30422db941d413888ec708af3f5906084704c5df600bf616cdce","replaces_plan_id":"prospective-checkpoint-route-plan-e660cf0ca491af828e6c8ec1c720dee2f1319c0b49d81302730ff183afa2426f","schema_version":"market-impact.prospective-checkpoint-route-plan.v2"}
